,Show,Date,Doors,Showtime,Postponed?,Link
0,ALT 104.5 Presents Wallows: with special guest Spill Tab,"Thu Jun 23rd, 2022",7:00 pm,8:00 pm,,https://themetphilly.com/event/wallows/
1,Puscifer,"Fri Jun 24th, 2022",6:30 pm,8:00 pm,,https://themetphilly.com/event/puscifer/
2,Barenaked Ladies: Last Summer On Earth Tour,"Tue Jul 12th, 2022",6:00 pm,7:00 pm,,https://themetphilly.com/event/barenaked-ladies-2/
3,Deadmau5: We Are Friends Tour,"Fri Jul 15th, 2022",7:00 pm,8:00 pm,,https://themetphilly.com/event/deadmau5-3/
4,The Cult: We Own The Night,"Fri Jul 22nd, 2022",6:30 pm,7:30 pm,,https://themetphilly.com/event/the-cult-2/
5,WXPN Welcomes Beach House: Once Twice Melody Tour,"Sat Jul 23rd, 2022",6:30 pm,8:00 pm,,https://themetphilly.com/event/beach-house/
6,BANKS: Serpentina Tour,"Thu Jul 28th, 2022",7:00 pm,8:00 pm,,https://themetphilly.com/event/banks/
7,Monica: Creative Nation Presents,"Sat Jul 30th, 2022",7:00 pm,8:00 pm,,https://themetphilly.com/event/monica/
8,RuPaul’s Drag Race: Werq The World 2022 Tour,"Fri Aug 5th, 2022",7:00 pm,8:00 pm,,https://themetphilly.com/event/rupauls-drag-race/
9,The Driver Era: with special guest Summer Salt,"Sat Aug 6th, 2022",7:00 pm,8:00 pm,,https://themetphilly.com/event/the-driver-era/
10,Alicia Keys,"Sun Aug 7th, 2022",7:00 pm,8:00 pm,,https://themetphilly.com/event/alicia-keys/
11,GIVĒON: GIVE OR TAKE TOUR 2022,"Tue Aug 16th, 2022",,8:00 pm,,https://themetphilly.com/event/giveon/
12,David Gray: White Ladder: The 20th Anniversary Tour,"Thu Aug 18th, 2022",6:00 pm,7:00 pm,,https://themetphilly.com/event/david-gray-2/
13,Lauv: The All 4 Nothing Tour with Special Guest Hayley Kiyoko,"Fri Aug 19th, 2022",6:30 pm,7:30 pm,,https://themetphilly.com/event/lauv-2/
14,Amy Schumer: Whore Tour,"Sat Aug 20th, 2022",7:00 pm,8:00 pm,,https://themetphilly.com/event/amy-schumer/
15,WXPN Welcomes The Decemberists: Summer Tour 2022,"Thu Aug 25th, 2022",6:30 pm,8:00 pm,,https://themetphilly.com/event/the-decemberists-3/
16,"Celeste Barber: Fine, Thanks.","Fri Aug 26th, 2022",6:00 pm,7:00 pm,,https://themetphilly.com/event/celeste-barber/
17,Girls Gotta Eat,"Sat Aug 27th, 2022",7:00 pm,8:00 pm,,https://themetphilly.com/event/girls-gotta-eat/
18,Kurtis Conner Live: On Tour 2022,"Thu Sep 1st, 2022",6:00 pm,7:00 pm,,https://themetphilly.com/event/kurtis-conner-live/
19,Crowded House: Dreamers Are Waiting North American Tour,"Fri Sep 2nd, 2022",6:30 pm,7:30 pm,,https://themetphilly.com/event/crowded-house/
20,Marcus King: WXPN Welcomes,"Fri Sep 9th, 2022",7:00 pm,8:00 pm,,https://themetphilly.com/event/the-marcus-king-band/
21,Bauhaus,"Sat Sep 10th, 2022",7:00 pm,8:00 pm,,https://themetphilly.com/event/bauhaus/
22,Ringo Starr:  and his All Starr Band,"Sun Sep 11th, 2022",6:30 pm,8:00 pm,,https://themetphilly.com/event/ringo-starr-2/
23,XPN Welcomes Father John Misty: with Suki Waterhouse,"Tue Sep 13th, 2022",7:00 pm,8:00 pm,,https://themetphilly.com/event/xpn-welcomes-father-john-misty/
24,Lady A: Request Line Tour,"Thu Sep 15th, 2022",6:30 pm,7:30 pm,,https://themetphilly.com/event/lady-a/
25,Porcupine Tree: Closure / Continuation,"Sat Sep 17th, 2022",6:30 pm,8:00 pm,,https://themetphilly.com/event/porcupine-tree/
26,The Always Sunny Podcast,"Sun Sep 18th, 2022",,8:00 pm,,https://themetphilly.com/event/the-always-sunny-podcast/
27,The Always Sunny Podcast,"Mon Sep 19th, 2022",7:00 pm,8:00 pm,,https://themetphilly.com/event/the-always-sunny-podcast-2/
28,Alec Benjamin: The (Un)Commentary Tour with Claire Rosinkranz,"Tue Sep 20th, 2022",7:00 pm,8:00 pm,,https://themetphilly.com/event/alec-benjamin/
29,Lil Nas X: Long Live Montero,"Thu Sep 22nd, 2022",6:30 pm,7:30 pm,,https://themetphilly.com/event/lil-nas-x/
30,Chris Rock: Ego Death World Tour 2022,"Fri Sep 23rd, 2022",7:00 pm,8:00 pm,,https://themetphilly.com/event/chris-rock/
31,Chris Rock: Ego Death World Tour 2022 ,"Sat Sep 24th, 2022",7:00 pm,8:00 pm,,https://themetphilly.com/event/chris-rock-2/
32,Chris Rock: Ego Death World Tour 2022,"Sun Sep 25th, 2022",7:00 pm,8:00 pm,,https://themetphilly.com/event/chris-rock-3/
33,The Mars Volta,"Tue Sep 27th, 2022",,8:00 pm,,https://themetphilly.com/event/the-mars-volta/
34,Lil Durk: The 7220 Deluxe Tour,"Wed Sep 28th, 2022",7:00 pm,8:00 pm,,https://themetphilly.com/event/lil-durk/
35,Death Cab for Cutie: Asphalt Meadows Tour,"Thu Sep 29th, 2022",6:30 pm,8:00 pm,,https://themetphilly.com/event/death-cab-for-cutie/
36,Carly Rae Jepsen: The So Nice Tour,"Sat Oct 1st, 2022",7:00 pm,8:00 pm,,https://themetphilly.com/event/carly-rae-jepsen/
37,WXPN Welcomes Pavement,"Wed Oct 5th, 2022",6:30 pm,8:00 pm,,https://themetphilly.com/event/pavement/
38,The Gaslight Anthem: with Jeff Rosenstock,"Fri Oct 7th, 2022",7:00 pm,8:00 pm,,https://themetphilly.com/event/the-gaslight-anthem/
39,Demi Lovato: Holy Fvck Tour,"Wed Oct 12th, 2022",7:00 pm,8:00 pm,,https://themetphilly.com/event/demi-lovato/
40,Gorillaz: with EARTHGANG,"Fri Oct 14th, 2022",6:00 pm,7:30 pm,,https://themetphilly.com/event/gorillaz/
41,Gorillaz: North America Tour 2022,"Sat Oct 15th, 2022",6:30 pm,7:30 pm,,https://themetphilly.com/event/gorillaz-2/
42,"Yung Gravy & bbno$: Baby Gravy, The Tour","Thu Nov 17th, 2022",7:00 pm,8:00 pm,,https://themetphilly.com/event/yung-gravy-bbno/
43,Smokey Robinson,"Sat Nov 26th, 2022",7:00 pm,8:00 pm,,https://themetphilly.com/event/smokey-robinson/
44,Gov’t Mule,"Thu Dec 29th, 2022",6:30 pm,8:00 pm,,https://themetphilly.com/event/govt-mule-3/
45,Vance Joy: In Our Own Sweet Time Tour 2023,"Tue Feb 7th, 2023",7:00 pm,8:00 pm,,https://themetphilly.com/event/vance-joy/
46,Dead Can Dance,"Sat Apr 22nd, 2023",6:30 pm,8:00 pm,,https://themetphilly.com/event/dead-can-dance-2/
